{
  "dossier_id": "D-PILOTE-RES-002",
  "step": "data-facts",
  "artifact": "timeline_faits.json",
  "events": [
    {
      "type": "date_reference",
      "date": "2026-04-28"
    },
    {
      "type": "collecte_documents",
      "date": "2026-04-05",
      "source_id": "SRC-DOCS-101"
    }
  ],
  "source_fixture": "case_pilote_confiance_limitee.json"
}