{
  "dossier_id": "D-PILOTE-RES-003",
  "step": "data-facts",
  "artifact": "timeline_faits.json",
  "events": [
    {
      "type": "date_reference",
      "date": "2026-04-28"
    },
    {
      "type": "inspection",
      "date": "2026-04-12",
      "source_id": "SRC-INSPECTION-201"
    }
  ],
  "source_fixture": "case_pilote_revision_conformite.json"
}